{
	"schema_version": "1.1",
	"generator": {
		"name": "lushly-health",
		"version": "0.1.0"
	},
	"generated_at": "2026-01-01T00:00:00Z",
	"targets": [
		{
			"id": "tidy-lib",
			"path": "<fixture>/tidy-lib",
			"language": "python"
		}
	],
	"policy": {
		"check_ids": [
			"gitattributes_lf",
			"lefthook_configured",
			"dependabot_configured"
		],
		"disabled": [
			"dependabot_configured"
		],
		"severity": {
			"gitattributes_lf": "required",
			"lefthook_configured": "required",
			"dependabot_configured": "required"
		},
		"remediation": "none"
	},
	"outcomes": [
		{
			"check_id": "gitattributes_lf",
			"target": "tidy-lib",
			"status": "passed",
			"severity": "required",
			"message": ".gitattributes enforces LF line endings",
			"evidence": {
				"paths": [
					".gitattributes"
				],
				"required_tools": [],
				"kind": "local_configuration_heuristic",
				"metric": "LF"
			},
			"remediation": null,
			"schema_version": "1.1"
		},
		{
			"check_id": "lefthook_configured",
			"target": "tidy-lib",
			"status": "passed",
			"severity": "required",
			"message": "lefthook.yml has pre-commit and pre-push hooks",
			"evidence": {
				"paths": [
					"lefthook.yml"
				],
				"required_tools": [],
				"kind": "local_configuration_heuristic",
				"metric": "2/2"
			},
			"remediation": null,
			"schema_version": "1.1"
		},
		{
			"check_id": "dependabot_configured",
			"target": "tidy-lib",
			"status": "disabled",
			"severity": "required",
			"message": "Explicitly disabled by selected policy",
			"evidence": {
				"paths": [
					".github/dependabot.yml"
				],
				"required_tools": [],
				"kind": "local_configuration_heuristic"
			},
			"remediation": null,
			"schema_version": "1.1"
		}
	],
	"summary": {
		"passed": 2,
		"failed": 0,
		"warn": 0,
		"skipped": 0,
		"disabled": 1,
		"unavailable": 0,
		"error": 0
	},
	"verdict": {
		"status": "passed",
		"required_count": 2,
		"blocking_count": 0
	},
	"effects": [
		"target_read"
	],
	"artifacts_written": []
}
